cxroe1y,geminia999,"&gt; That is done in two ways: by highlighting the ways in which identity generates unfavorable treatment for unprivileged groups, and by highlighting the way identity generates favorable treatment for privileged groups.

And where exactly is the middle ground, the default? Privileged people are treated unfairly beneficially, and unprivileged people are disadvantaged. Where is the group that is neither unfairly advantaged or disadvantaged? What is the base level of human treatment that is not unfair?

That's a big part of my issue is that there really is no room for a base treatment, if someone is treated somewhat better, everyone else is now unprivileged in comparison. There can be no base level because as soon as there is someone above or below it, we have created a huge dichotomy. To say that one may be treated for their efforts is unfair treatment when another is discriminated for identity is just not right. Wouldn't it better to look at it along the lines of 3 groups? That there are people who are chosen because of their identity, privileged, people not chosen because of their identity, unprivileged, and those who are chosen/not chosen not due to identity, default or neutral. By conflating groups the first and last groups you just seem to making bigger issues and suggests that the solution is something entirely different.

Sorry, but if the discussion on privilege refuses to recognize that concept, I have to say it's designed to pit two groups against each other and create animosity rather than cooperation.

&gt;It's not about revenge - it's about acknowledgement.

May I ask how ""punching up"" and ""Male tears"" are exactly acknowledgement? 

Don't you feel that constant language such as oppressors and privilege are going to make people get upset at these groups and associate them with such terms negatively? Even if it isn't about revenge in it's base concept, it certainly seems to be breeding a lot of hostility and anger through how it chooses to get across it's message. ""These people don't deserve to be treated better than us, they oppress us. they hurt us!"" It certainly creates an attitude among people that could be pretty easy to get lost in don't you agree?

&gt;That's why you'll certainly see discussion of privilege, but the highest levels of frustration with unexamined privilege. Too many members of privileged groups (the same groups that hold social, political, and economic power) either don't see or refuse to acknowledge the way privilege affects their life.

And just a personal gripe, but that's part of my own issue with the movement, they only care for some privileges. How many people who prominently do end up supporting Social Justice end up being from some pretty rich backgrounds (see for example, the man who did the hunger strike recently, who is the son of a multi-millionaire), yet seemingly ignore wealth as a privilege. It seems so common a phrase to say ""those who have privilege can't see it"" but they never seem to take that mean that they should potentially direct the lens back at themselves. I mean, in regards to issues with women, do you ever see female privilege as an idea ever pop up? There is basically no consideration that there might be some while you can have some of the most benign and untrue stuff be considered male privilege.",cxrmukk,1449593809
cxrvk1t,geminia999,"And this is the specific rhetoric of the majority of these groups. Can you find me some people who claim to be social justice currently and do not use any rhetoric that devolves into ""us vs. them""",cxrtwro,1449603437
cxrx1z9,geminia999,"&gt; And to demand perfection from minority groups when you are not criticizing the majority groups who are antagonizing them is deeply problematic. You're holding them to an unfair standard.

They aren't the same standards as the are two completely different groups. One is activism while the other is a group of people just existing.

Also, I'm not demanding perfection, but I am asking for people who say they wish to bring people up to stop trying to bring people down. As well, whose to say I don't criticize majority groups?",cxrttq3,1449605426
cxu8yxx,z3r0shade,"&gt; Otherwise where do we stop with banning things that exist ""just for fun but can harm people""?

A gun isn't something that exists "" just for fun but can harm people "" it's something that exists ""for the sole purpose of harming people, but can be used without harming"".

Big difference here. The primary reason for the existence of guns is to harm others",cxu8n2w,1449766751
cxx558n,twinshk2,"I am arguing against the use of race as a factor. Of course it's not the only factor, there are many many others. However, when the disprity is so huge:

&gt;After controlling for grades, test scores, family background (legacy status), and athletic status (whether or not the student was a recruited athlete), Espenshade and Radford found that whites were three times, Hispanics six times, and blacks more than 15 times as likely to be accepted at a US university as Asian Americans.

I don't know how it couldn't be anything other than racism. Why do schools sometimes(or going by the data, most of the time) admit students who are black over those who are Asian? Is it possible that the extracurriculars and essays of black students better than Asians 95% of the time? I don't think so. ",cxx4vnu,1449978469
cxze77s,zuzununu,"I think if you are at the point where you are giving gifts primarily to avoid the awkwardness of giving nothing, it's time to have a conversation about not wanting to do the gift thing any more.

I'm not saying negotiation is bad, but it's not the realm of conventional gift giving.

Collaboratively getting together and making an experience out of buying a gift is great! But this fact doesn't preclude that giving gifts is also good. There's lots of situations where you can't visit the store together, and while I agree with you that it's potentially very fun to receive money or gift cards and to make a good day out of spending them, in practice, this isn't what happens.

Even if is, it's a lot of work, and if all gifts required effort on the receiver's end, there would be a big loss of utility.

I'll return to my point:When you start asking for money, you alienate the giver, and reduce gift giving to practical exchange. This is bad because gift giving as an activity is fun and has value! There's also problems with it, and it's not for every relationship, but this is a fundamental argument for gift giving.",cxzcx7w,1450145422
cxys7ki,Coolaccount2,"&gt; ultimately the main purpose of giving a gift is to find something the other person wants 

I think the main purpose of giving a gift is to show that you put thought into who they are as a person, and gave them something that took you time and thought to put together or pick out, and something that maybe they wouldn't have bought for his/herself. I think handing somebody a check for $20 is just about the most thoughtless thing you could do for a gift-giving holiday. There's no consideration for the individual there; just, ""You're a human, all humans like money, so here you go."" The phrase is ""it's the thought that counts,"" because that's what gift giving is really for. Not just an exchange of goods.",cxyqx4g,1450111044
cy2wveh,everystoner,"Because complaining about a lack of diversity is racism, sexism, whateverism in itself.  It presumes that there is something inherently different about the races or genders or whatver and therefore you need a certain amount of each category to be good, effective, etc.

If we're all the same and every race and gender has equal talents and abilities, then a black woman can make the exact same contribution as a white man, or a Hispanic lesbian or a transgender asian.",cy2wicd,1450402325
cy3ygzr,uscmissinglink,"I'm not going to pretend to know the intimate details of the movie audio business, but I do know a little bit about business in general.

For example, if you're in a field that is over-saturated with talent the result is going to be low pay. You're expendable. If someone can do the same job for cheaper, they're going to get the job.

In this sort of market, where there is an army of young interns who will go *Swimming with Sharks* for your job, the lack of professionalism demonstrated by slipping in a sound effect that detracts from the film should be a deal-breaker for future work.

The higher competition and lower wages doesn't justify personal acts of sabotage. In fact, I think it does a lot to advance the opposite argument.",cy3y258,1450481444
cy75rzw,LtFred,"Car driving is fundamentally bad for your health, not a matter of circumstance. You are less healthy for living in a car-based city than a proper one. You are more likely to kill yourself, divorce, have fewer friends and be generally depressed. This is because suburbia is horrible, fundamentally. Fact.

Denser cities are always cheaper and better. Every time, always. Vancouver is better and cheaper than Atlanta.

Cars are fundamentally polluting. Electric cars pollute far more than rail, due to mechanical processes and the grid.",cy6x6kp,1450741223
cy7iqok,Arkiasis,"It doesn't matter if you love doing it, doing something for 50 or 60 hours a week every week will make you sick of it very quickly. Even your most favorite hobbies will get boring after a while.",cy78bnm,1450764885
cyb5d6u,Foxtrap_Congo,"if you don't make your intentions obvious, men don't pick it up. If you make your intentions obvious, you're a cheap whore worth fucking once.

I've never seen the same man ejaculate twice.",cyb54ri,1451071050
cybw0qw,GP4LEU,"The major difference between pro-life and pro-choice against abortion is the part of pushing your views on to other women. It's one thing to not agree with abortion, no one is forcing you to do that and many people pro-choice are on your side. It is another thing to want a law saying *no one* can get an abortion. It's pro-**choice** not pro-**abortion**
",,1451148705
czticlr,chrizzlybears,"""pursue their passions and advance society"" I think you have to make your argument here either or, either you want to value strictly according to the benefit of human kind, or you also value some individual gain which has by itself nothing to do with the progress of mankind.  
I want to challenge the idea itself though, since people are not at all paid in any relation to what they bring to society. The magnitude part ist obvious and you mentioned it already, so I take that as granted. But also the idea that people are gaining roughly to what they bring to humankind is strange to me, someone can be super productive producing landmines and earn a ton, but what exactly is his contribution to society? Compare that to low wage jobs, for example people working with elderly or children..",czthklq,1455032548
d1fa99y,sailorbrendan,"We're talking about TRP, which is a pretty toxic place. Femminism and Men's Rights aren't antagonistic towards each other, and a lot of the problems for each stem from the same root causes. 

Equating TRP to the MRM is an insult to legitimate mens rights issues",d1fa74d,1459092300
d1faacs,Xemnas81," &gt; Femminism and Men's Rights aren't antagonistic towards each other, and a lot of the problems for each stem from the same root causes.

Are you pulling my (dead) leg? Feminists and Men's Rights Activistss are at WAR. (a pathetic online keyboard war mostly)",d1fa99y,1459092359
d1q6e1q,LukeBabbit,"The fed is a disaster. It allows a government that shouldn't even exist to inflate there money and screw over the lower classes by by printing nodes, which only helps the rich bankers. Just stop. Everyone with a brain knows that the gold standard is the best, even though a a central currency shouldn't exist AT ALL.   ",d1q67lu,1459821836
d1s346q,Wild_Hunt," &gt;What do you mean?

Well take this quote from MLK's speech at the March on Washington, the high point of the civil rights movement:

""one day right there in Alabama little black boys and black girls will be able to join hands with little white boys and white girls as sisters and brothers.""

Or if that doesn't do it for you think of Desmond Tutus idea of a ""rainbow nation"" if you want a non American civil rights figure as an example. Both of these show that the original civil rights movements advocated multi cultural unity, regardless of colour or race. SJW's as we've seen strive for racial segregation, for cultures to never be mixed for fear of ""appropriation"", for in some cases for there to be  racism against whites as payback for past discrimination against blacks. All rather against MLKs and others visions no?

&gt;If you think it is an ""institutionalized conspiracy"" then you don't really understand what people are talking about. They're not saying there's a secret cabal of white men keeping everyone down.

No they're advocating that the entire system, sometimes the entirety of Western civilisation, is built on institutionalised racism and a load of other isms.

&gt;I'm a white man, and nobody has ever made me feel like I've committed some original sin by being born.

You've never heard of ""check your privilege""? It assigns automatic guilt and fault to someone regardless of actions, rather like the religious concept of original sin. To move away from racial privilege I consider myself an ally of the LGBT movement yet some people would say that simply supporting LGBT rights wouldn't be enough. I'd have to check my straight privilege, understand how I might ""oppress"" others etc. Again rather like original sin.


&gt;People bash fat people just for existing all the time. There was an entire subreddit dedicated to that very notion.

How? Advocating a healthy lifestyle and suggesting that one should aspire not to be unhealthily over weight is simply the truth if that's what you mean by bashing. If you mean r/fatpeoplehate when you say a sub it got banned a long time ago and had what? A few hundred users, many of whom were satirical.

&gt;No, it would not. Segregation and Jim Crow was a whole institution aimed at keeping black people as second class citizens. This doesn't do anything of the sort, it's just a space for a group of people to congregate. Do I necessarily think that racially segregated safe spaces are a good thing? Not really, but not for some bullshit ""we're going back to Jim Crow!"" alarmism.

The entire concept was ""separate but equal"", isn't that what SJW's seek to resurrect with their idea of segregation?

&gt;They're like movie ratings, just a way for people who avoid topics that might cause them distress if it pops up out of nowhere.

And how far should this go? I mean ""I'm offended"" is used to shutdown entire debates. Maybe no one cares if it upsets you and unless you have very real PTSD there's no excuse as an adult to try and shut someone else up based on your convictions.

&gt;Could you tell me what some of these ""actual facts"" are that people are trying to avoid in safe spaces?

Basic biology? No you don't have ""headmates"" who share your body, you need to seek medical help. No, biological sex isn't a social construct. Common sense? No, otherkin can't really have the soul of a dragon or wolf.

&gt; There's this idea out there that every single area needs to be widely open to all discussions all the time. 

We're talking about campuses here, not even dorms or private rooms or whatever. Areas meant for discussion.

&gt;But that's just not the case. Do you get upset at funerals when you can't spend the whole time bashing the deceased? Do you think that weddings are an affront to free speech just because the group won't tolerate you giving the bride and groom shit?

Strawman. I'm not arguing for the right to say what you want where ever. I'm talking about not using offense or safe spaces to shutdown legitimate debates.

&gt;As a straight white cis man, I can just fuckin' go to a school cafeteria and nobody will give me shit for who I am or claim that my gender isn't real or talk about how I and people like me are more prone to violence.

Maybe your gender isn't real",d1s1tac,1459950184
d1shzpm,jakefromstatefarm10,It's more of a potential thing I think. Why give mentally retarded and autistic kids so much funding just to dance them around and shit. I get the emotional argument but I'm so sick of it. We had to cut the usual AP physics trip to the national lab because we didn't have enough and it was too costly to really ask the parents to pay. Meanwhile they get fucking dances once a week and stupid benefits god I'm so bitter for some reason help.,d1s55z2,1459969496
d1somfl,jakefromstatefarm10,"I would agree and say it's worth it, if they could actually do anything with all of the shit they get. Take away from kids with real potential and gifts to make them feel good inside for a second. Hell, my school doesn't even have classes for gifted students. Such a waste.",d1snrqd,1459977775
d1sqjkh,jakefromstatefarm10,"Except we hardly do. The amount of the budget they get from my underfunded public high school is so ridiculous. Slice it half and it's still more than our AP programs. I'm not saying leave them to die just stop glorifying them, stop giving them so much useless nonsense so they 'feel good', and stop taking away from people with potential to give yourself a god damn pat on the back.",d1spw9m,1459980419
d1srtyr,jakefromstatefarm10,"Oh I disagree, sir. In this regard specifically I doubt it would make anything worse. Outside of little parades and parties have you ever been positively affected by a mentally retarded person? There are certainly places where life needs a little emotional and non-productivity but this is hardly the place. Chop their funding and stop giving them their own dances and benefits. How about give them a little place at prom or something where social protocol pretty much forces us to give them a 5 minute standing ovation? They get their 'real kid' experience and a little feel good moment. Anything more is stupid and for the sake of glamour and misplaced romanticism. We will only gain from doing this I'm pretty sure. I'm pretty out of touch with people's general feelings so I really don't know if taking away their parties will have a real impact.",d1sr1m9,1459982305
d1ty78s,DonnieRumpsco,"Because I know the sort of people who are non-binary (or claim to be, maybe not real ones IDK) and they were ALWAYS attention seekers.

always posting needy mental health posts on Facebook
always pretending to be drunker than they were and singing loudly
always being politically contrarian ",d1txuln,1460057462
d1v5plh,meddlingmages,"George Lipsitz is african american studies professor? His viewpoints wouldn't be skewed or  biased at all. 

So two people do the same ""appropriating"" but one (the white individual) should feel worse about it and the other (the black individual) is afforded said opportunity because, well, racism right? Same act, same discussion but one person isn't supposed to partake due to the fact that they are white. You also keep eluding to this ""dominate"" culture, it is in fact the submissive ones (submissive culture in this case) who tend to keep themselves down at the  level at which they view themselves. ",d1v53xd,1460136315
d1vbxyo,112358MU,"But the problem is that I don't believe you (or anybody else) are objective. Sounds like you are just saying ""my side should have the right to free speech but the other side shouldn't.""  And what I am saying is that nobody should have the right to make that decision.  But we are talking about who is more aggressive here and since I don't see the other side making similar statements, I have to say that even if you were 100% right and I agreed with your statement completely, it would still be the more aggressive position of the two.   ",d1vbjbt,1460144454
d2ay1ww,TooMuchTuna223,"Except the only time the word ""leftist"" is ever used is as a word with negative connotation meant to discredit anything I say as the ramblings of a hippie",d2axehy,1461190610
d2hze5b,TomRoberts2016,"If you don't believe 60 women would lie to hurt a man, check out the feminism subs.",d2hyuxq,1461683297
d2koq88,dart200,"No I don't. The only reason sales, both to consumers and investors, is so heavily required is because of the endlessly enforced competition capitalism.",d2km8kn,1461852540
d3xxh5m,apricot-jam,"just like employees only work to make money, they don't care about their employer. soldiers, lots of times, especially yanks, have this patriotic shit/mentality drilled into them that makes them feel superior to others. that is why they do what they do",d3xxdnl,1465212643
