cvslf01,Navvana,"As a biologist (not my field though) I find this amusing. Especially the part about wanting to discredit the social sciences. Regardless if you want to argue semantics this will go nowhere. The CMV you first need to have is the far more fundamental ""I think gender and sex are the same thing"".  If you don't accept that they are distinct for whatever reason then of course those who do accept it will seem ridiculous in their behavior. That doesn't mean they are crazy. Those who accepted germ theory early were ridiculed for washing their hands despite tangible results. It occurs with religion everyday. What you are experiencing are people who have a fundamentally different view of the world than you. If you want to understand their actions you need to assume their initial premise is correct. Even if you think all these people are misinformed. ",cvsjbpm,1444320058
cvsiu8f,Throwaya3345,"&gt; Then there are those who quite simply don't buy into genders at all and want to eliminate the classification entirely for a reason I think you can get behind. It restricts liberty.

That's total nonsense. It doesn't matter how you feel, you're always either male or female. Even those with multiple genitalia are the same. Chromosomes. Saying you don't accept your gender for liberty is no different than saying you don't accept that you're human for cynical reasons. I'm not human, I feel like a meerkat. That doesn't make sense. ",cvsfr63,1444316174
cvsy8bc,Throwaya3345,"Ok, look, here's my issue. If you're going to say you aren't your birth gender because of societal roles of what gender is, how is that different from saying your black because you fit the stereotype of a black person even though you have no black bloodline? How is it different from me declaring I'm a dragon-kin because I feel like it? If it's just because, than that's not good enough for me. ",cvsw6oo,1444338666
cvs8ccg,Throwaya3345,"I already said I'm a fairly liberal guy who believes in peoples equal rights and treatment, that's why I kinda dislike how I feel right now. I have no problem at all with trans people, gay people, or bi people. They're perfectly ok. I think the stigmas against them are akin to racism. I just hate the multi gender crowd because their beliefs are so easy to tip over. I mean, we know gay people are probably just born gay. And we see it in nature, in many places. There's no logical argument against being gay. These people aren't born ""gender fluid"". 

Multi genders make no scientific sense. It's a fact that there's two genders, that's  it. Acting like you have a different gender because you may have some traits that aren't in total absolute lockstep with your culture's stereotypes doesn't mean anything. But they seem to think it does, and they're really annoying about it. Also, no, I didn't seek out these people, you're making horeshit assumptions about me. I've met them personally. They're degenerate abominations who just try to suck empathy out of you like vampires for the most asinine reasons. ""my boss called me a girl! I'm gonna go cut myself! And I'm telling you because I know you have too big a conscious to ignore me so i'm gonna take advantage of you!"". ",cvs7z3i,1444285226
cvs8vx1,Throwaya3345,"I do, actually. Ive met many. And they're some of the nicest people I've ever met. The problem is, when a guy feels he's female, or a female feels male, those genders are *real*. And you even admit they're made up. Believing you're something that's not real makes you a lunatic. Hey, I'm a vampire, I can turn into a bat too. 

Does that sound sane to you? And if not, what makes it different? ",cvs8p1f,1444287026
cvsxaph,Throwaya3345,"Like I said a million times before. Exceptions do not change the general rules.

Also, yeah, I knew I was a boy long before I understood all that stuff. You know what? I also knew I was human long before I understood what that really means. It must be nonsense. I'm a chimp now, because I wanna jerk off in public and throw my shit around.  After all, there was a time when humans and chimps were still close enough to have infertile offspring together. That must mean there's not just chimp and human, but we must also include all the in between, even though it's not relevant.

Just stop it already.",cvsvwuy,1444337291
cvthcdh,Frallec,"Because UBI is inherently flawed. What you are doing is not creating any value, it just destroys value. https://www.youtube.com/watch?v=KigzfZRf5ig here is a more in-depth explanation. But basically, moving money around does not create value, and is also immoral, because the money will be taken under the threat of violence.",,1444375861
cvtzrhj,hoppierthanthou,"Right. No one would be that poor in libertopia. Not like there are people who can't afford insurance now. Nope. You're also assuming a world in which everyone is perfectly informed in their buying choices which, while it would be ideal, does not reflect reality.",cvtyq4k,1444416423
cvu008n,GoldenTiger117,"Except that is not his point and your argument is irrelevant. If people who can barely support themselves DECIDE to have a bunch of kids they can't support then why should they get pay increases. Would you demand the same if a couple of street people had a bunch of kids ? Of course not. Also no that's NOT the way it goes not everyone wants to get married or wants or even likes kids.

I agree with OP people who can't afford kids shouldn't get their pay increased because they were too stupid to use protection or get an abortion",cvtyn5z,1444416781
cvu0ixx,GoldenTiger117,"What he's saying is that poor people shouldn't be able to have kids KNOWING they can't afford them and then turn around and be like ""see ? You need to pay me more because I can't afford these kids I shouldn't have had in the first place""

I'm not afraid to say what OP won't though. I absolutely believe that people who are so poor they can't afford kids should not be allowed to have them. Being stable and then suddenly losing your job is completely different than having no job/welfare/Shitty $10 an hour job and deciding to have kids.",cvu0b07,1444417556
cvu176g,GoldenTiger117,Wut ? I'm concerned about both. My stance is that if you're too poor to afford children you shouldn't be allowed to have them. ,cvu0wsb,1444418565
cvu3dxj,balancespec2,I'm arguing both. I'm arguing that kids are a luxury equivalent to driving a new car ir owning a house and you should neither expect to afford it on minimum wage nor should you expect your employer to help you afford it,cvu0dcx,1444421882
cvu5q1d,balancespec2,"See I don't get this whole moral obligation to continue our species. If we don't continue our species because we find it more beneficial to us to live our lives comfortably or find a way to live immortally, then how are we hurting future generations if they don't exist?

It's the same thing as worrying about ruining the planet. The only people who consciously care about the planet are us and we only care because of how it benefits us... so why people prioritize the planets well being above humans comfort and wants is beyond me",cvu5fwt,1444425584
cvu7eko,LUClEN,"That stance is a problem as starting a family is necessary for the state to thrive and continue to function the way it does. Since it is required, and citizens are required to do it, there should be some form of compensation for it. If we expect people to reproduce, but do not give them a means to manage that task, we are asking people to do what they can not, and then punishing them for it, all so society can continue to grow and operate. ",,1444428372
cvu32bx,exaltedgod,"&gt; Which costs money. That minimum-wage workers generally don't have, because they're struggling just to stay fed, clothed and housed.

Which there are programs for people that do not make enough. Billions of dollars go out the window in unaccepted grants or scholarships. There are so many paths for people to better themselves but instead of trying to figure that out, they would rather just stick out their hand and say ""Where is mine?""",cvu28pz,1444421411
cvu3q5s,exaltedgod,"No it doesn't. But how many people are actually really trying to get better at a demanding skill? Not a lot apparently since job boards are looking and taking dam near any body nowadays. Those that can't, get the support they need to get by but if they want a grander life they have to break the box and do things beyond their limitations.

Either you want it bad enough you work your ass off for it, or you are okay with being mediocre. There isn't a middle ground to be had there.",cvu3kzw,1444422379
cvycdhd,nude_peril,"Without a gun, how will I be able to protect my life against a superior attacker (either physically superior, or an illegally armed attacker)?  Do I have no right to protect my own life, or the life of my family, against someone who wishes me harm?",,1444757239
cvymxnt,Arizth,"Fair point, but animals still aren't citizens, and so have no right to free speech.

""Rights"" to anything are a human social creation. Most animals aren't humans.",cvymtek,1444771839
cw50tk0,alanforr,"&gt; 2/3 of gun homicides in America are suicides.
&gt;
&gt; So it's clear that at least 2/3 of gun homicides are mental health issues; if the suicidal person had proper mental health treatment, they likely would have been able to overcome their suicidal thoughts/tendencies.

When a person commits suicide he does so because he sees it as a solution to his problems. For example, if he has a lot of debt that he doesn't know how to repay, his creditors won't be able to hound if he is dead. Or if he wants sex but no woman will touch him, then he may prefer death to living alone.

A person does not commit suicide because of a fault in his body. Suicide isn't like an epileptic fit. It requires taking deliberate actions. In this particular context, suicide requires finding a gun, picking it up and then putting it to some part of your body and pulling the trigger. This action is not an accident, or a twitch, or a fit; it is a choice.

If you're saying you want to prevent a person from making that choice you have a moral disagreement with him: that is not a medical issue. If you are saying the person should be ""treated"", then you are advocating offering him some option that you see as helpful. This is also a moral issue.

Some people will turn down such help if it is offered. If, as is common today, such a person is told that he has no choice and will be locked up in a mental hospital without trial, and with no hope of release except at the whim of psychiatrists, then you are advocating reducing that person to a rightless lump that you can dispose of as you see fit. Your position implies that such a person has no right to control his life or death. And if he attempts to take control over his own death he will be punished: you will inflict something on him that he does not want. This is a legal and moral issue.

A person who commits mass murder also takes deliberate actions to do so. This is a result of values, not some fault with his body. This person has made a choice to murder a load of people. How this person should be treated is a moral and legal issue, not a medical issue.

If your suggestion is to offer people who are having a hard time sympathy, or advice, or drugs or whatever, you should say that clearly. If your proposal is to inflict sympathy, or advice, or drugs on people having a hard time without their consent, then you should say that clearly.

For clearer explanations of why your way of putting things is wrong see ""The Medicalisation of Everyday Life"" by Szasz.",,1445252039
cw5ilg6,alanforr,"There is not overwhelming evidence to refute my claim. There is no way to detect mental illnesses solely by testing the chemical and structural properties of the body. Look at the diagnostic criteria in the DSM for schizophrenia. It lists behaviour and then exclusion criteria for medical conditions:

http://www.schizophrenia.com/ami/diagnosis/mrBIPOL.html.

And it's also not the case that there is a test that can be done during autopsy looking at brain structure to determine whether the person was mentally ill. There is no evidence that mental illness is a result of faults in the body. As a result the fact that people who commit suicide were diagnosed as mentally ill provides no evidence that it is a medical problem.

And it would be surprising if there was such evidence. There is more to life then whether your body happens to be working properly. There are problems to do with stuff other than medicine, like debt, loneliness, employment problems, boredom, problems getting along with relatives or friends and other stuff too. You think all of that stuff is a medical problem?",cw54iof,1445284319
cw57tgv,fuck_sjws13,"It may be tautological, but so many people are indoctrinated with the feminist ""women are perfect angels who can do no wrong"" narrative that they refuse to believe it.",cw56uup,1445268353
cw66tiy,PanopticPoetics,"&gt;Certainly this sort of language is not conducive to actual understanding.

I agree: the caricature you've portrayed of the authors position is probably not all that fair. Now, I haven't read this particular book that you speak of, but I can see a line of reasoning in between the lines of your paraphrase and it is fairly common--which leads me to believe you are not being charitable in your interpretation. Can't imagine much understanding can take place amidst this kind of misrepresentation. And clearly not much understanding did take place if you think what the author is saying is that of ""equating today's whites with the whites of 200 years"", as if the author is blaming white people today for the actions of white people 200 years ago. Because of the way you've read the author, it seems like you want to say that we don't owe reparations. This is what you are saying, right? Please correct me if I'm wrong. (Clarifying your position might be helpful for me, as it seems like there are a few distinct issues in your post that are being blurred together.) I think you might be arguing against something nobody is arguing.

Lets look at an analogy, which will hopefully clear up some of the confusion (but not all of it (it is not the best analogy and only addresses one point, and also leave behind many subtleties)).

Let's say person A cheats person B out of their life savings. Most would consider what A did to B was wrong, and that the money the A now has in their possession is ill-gotten or illegitimate. This leaves B in a very poor spot, dissolving the life prospects of B and their family. Now, suppose that A and B both die and pass on their belongings to there children: A has child G, and B has child R. G now owns all the money that A cheated B out of (and by extension cheated R out of). R is worse off now than they would have been had not A cheated B. G is better off than they would have been had not A cheated B. 

Now, can you honestly say that the money that G has now, by way of inheritance, somehow is not still illegitimate, just because it has been passed on to someone else's hands? By what magic would this ill-gotten money cleans itself? If G was at all concerned with justice, what do you suppose they would do with the money? I think what justice calls for is for G to pay reparations to R, even though G is not the person that cheated B out of their money. No one is blaming G for what A did, but G is blameable and complicit if they do nothing to right the wrong, especially when one has or is currently benefitting from said wrong at the expense of others. A wrong that is never redressed does not just go away if we ignore it.

&gt;Every white person alive (shit, probably even modern Klansmen) can convey that history of white appropriations are to blame for virtually every economic, political, and probably social issues blacks in the Americas face. 

I can point you to some subs here on reddit, if you want, where a majority of the users don't believe this.

&gt;there's nothing you or I can do about it. 

Bullshit. There is nothing we can do to change the actual past, but there is plenty we can do going forward.

&gt;The author is being condescending

Let's pretend that this is actually about language and/or method of the message. Why is being condescending off the table? Why is it such a bad tactic, especially when no one seriously cares to hear what you have to say otherwise (particularly when it falls outside of the dominate narrative)? You understand how debilitating marginalization is, right? It seems to me this call for politeness is still the dominate group setting the rules of the game in their favor. Why should the subordinated group not try to find other ways to get a voice, outside of the ""acceptable ways of discourse"" determined for them? Why should they not be mad and frustrated? What have they got to lose when they are mostly silenced anyways?",,1445330217
cw989qf,daniwoodwardama,"I'm going to assume you are for the free college after you made a point about college debt. Free college is a terrible idea, not from a misused of tax money, but it will only inflate the job market and lower wages. ",cw984zs,1445543898
cw9e087,ZenerDiod,"&gt; I'm holding off on my PhD because it's 50k.

You're holding off your PhD because you don't think it would be worth the investment, and that's a good thing. You said talented kids shouldn't drop out because they can't afford it, I ask again, where has a kid with good grades dropped out in the middle of a program due to lack of funds?

&gt;I don't think the point of education should be job training.

I have to disagree, in a modern economy it is **the** point of education. It's 2015, if you want to learn for the sake of learning they're plenty of online resources, that how I learned everything I know about the humanities and social sciences. 

&gt;If it's necessary to educate to improve an advancing field, it's in our interest to remove cost.

I already linked in this thread to a study that shows the American work force is overeducated, not undereduated.",cw9dgm4,1445552594
cwaw98i,silverence,"Notice how I said people on university campuses, which absolutely tend to be more pro-choice.

Also notice how I didn't take one position or the other. I stated facts. What is it with conservatives that make them automatically assume they know someone else's position when discussing divisive issues? Is it because they just tend to rely on stereotypes and generalizations, or is it just their pathetic persecution complexes?",cwankzi,1445662316
cwbq8cp,Dathadorne,"&gt; every vegetarian spares the life of around 75 animals a year due to supply and demand. 

Why do you keep assuming these lives have inherent value? You haven't established that they do, and it's a gaping whole in your arguments.

These ""75 lives"" wouldn't even exists but for the need to turn them into food.",cwbn4yf,1445735334
cwbm0cn,doug_seahawks,"I am opposed to animal abuse. Why? Because I don't think someone should go and kick their dog for barking, or throw rocks at a cat because they think it is funny. These animals did nothing wrong, and intentionally causing them harm does nothing beneficial for anyone while harming the animal. In it's most basic sense, I would consider animal abuse the unnecessary harming of an animal.

The key word in that statement is unnecessary. I think that factory farming of meat is a necessary part of our global economy and food source. Just think about what would happen if we somehow magically removed all meat from everyone's diet due to ethical concerns. [The average person eats around 92 pounds of meat per year](http://chartsbin.com/view/12730) and, with your number of &gt;99% coming from factories, let's just say 91 pounds of meat is removed from everyone's diet. 

How would we possibly get the farmland available to produce 600+ billion pounds of soy product? Is the meat production industry perfect? Not at all, but I recognize it as an necessary fact of global food production, and therefore think it is unreasonable to boycott it as abusive. ",,1445727129
cwhovlc,AntonioOfVenice,"&gt; feminists going back as far as Bouvier 

Are you talking about Sartre's wife? If so, you misspelled her name.

&gt; have agreed that sexism is a cultural attitude that infects the thoughts, perceptions, and actions of everyone exposed to it, not just men. 

That may very well be, but feminists are now trying to claim that any woman who disagrees with their angry agenda has 'internalized misogyny'. As much as feminists proclaim to be ""stronk, independent women"" - their agenda is to deny women the right to be independent.

&gt; If any idea would be radical in feminist circles, it's that one, because it'd require a massive rejection of an entire century of feminist theory. 

Feminists take their 'theory' about as seriously as the rest of us. Which is why you now hear them echoing the belief that transsexuals are born with the brains of the opposite sex, whereas their previous belief was that gender is a ""social construct"". You can't hold both beliefs at the same time.",cwhornx,1446156742
cwp2s7c,noluv4uhoes,"&gt; I asked how you feel

I said it already in the OP and repeated it several times.

&gt;do you think, all things being equal, people who eat meat are less ethically superior to people such as yourself?

Ethically, yes, if the people are identical. How can someone who supports animal suffering be more ethical than an identical person who doesnt support animal suffering?",cwllrkm,1446698991
cwp3886,forestfly1234,"So you think that people who are vegetarians are ethically superior to meat eaters. Own that. Stop deflecting. Say that you think people who are vegetarians are better than those who aren't. Say that based on my personal ethics, I think I am qualified to judge who is a ethical person and who isn't. 

I'm better than you. Own those words. You think you're superior. 6 months of being a vegetarian and now you think you're better than all of us. 

You have been veggie for what 6 months. I'm pretty sure that I stacked up all the dead animals you are responsible for there would be a lot of stacking to do. Don't you agree. How many dead animals are you responsible for?


Let me clue you in on  something. I don't think you're any better than me. You're using something as a metric to claim that you're better than you value a lot, but I value you as zero. 

Vegetarianism to me is zero on the ethical scale. I don't owe you anything. You have zero superiority over me. You can claim it all you want. It doesn't mean I have to or should give you anything. 
",cwp2s7c,1446699928
cwly6ni,EagenVegham,"&gt; So you don't think marijuana ought to be legal in general

I don't think it should be illegal. I think it should be decriminalized and available to those who actually need it.

&gt;Why should we abide by laws we find unjust ? Are unjust laws still legitimate ? If so, why is this distinction meaningful ?

Just because a person disagrees with a law doesn't mean they should be able to break it without having to face some consequence. Unless there is some reason to break the law there is no reason to try and change it without breaking it.

&gt;Don't people unjustly treated deserve sympathy ?

I consider those who have need of marijuana but don't have access to it the ones who are treated unjustly and I do have sympathy for them. I do not have sympathy for those who break the laws simply because they want to.",cwlxty1,1446493780
cwm8vaw,HeyArnoldPalmer-,"So black teens who overall have an unemployment rate of 43.1% are actually BETTER off when illegal immigrants work for less than minimum wage?

Insightful.",cwm8s8o,1446509220
