cwsjhtw,Sonnington,"I can't follow your example. It's needlessly complex and not explained thoroughly enough to make sense. I also think the logic is fallacious and rather superfluous. Some simple questions: Why are you producing clocks at different prices if they both sell for 2 dollars? Why are you selling a clock for 3 dollars when you said you could sell it for 5 dollars?  Why are you selling a 3 dollar clock for 2 dollars? Why are you counting only selling the 1 dollar clock for 2 dollars and not counting the 3 dollar clock as a lose since you're forced to sell it for 2 dollars? There's a lot of logical problems with this example and flat out erroneous thinking. I'd like to leave your example behind as it's inherently flawed in both merit and results.

The real issue is that wealth is leaving the system in exchange for junk or disposable goods that does not create wealth. The fact that wealth is leaving is bound to create inflation and hurt domestic job creation. It's expedient and looks good initially for the consumer, but like all government policies the expedient good is often met with high costs down the line. Sure, no one argues that free trade creates lower prices for consumers, but it also creates inflation and takes jobs out of the market. So you're going to pay for it one way or the other.

Here's my example, I'm paraphrasing from something Warren Buffet once wrote. I can't find the original quote. Lets say we have two island nations. Both island nations have to work 8 hours a day to produce enough food to live off of. Island nation A decides to start working 12 hours a day in order to sell the surplus to island nation B. Island nation B now doesn't have to work as hard to produce the food they need. The prices of food go down and they have more free time. This is wonderful right? Island nation A gets money that they want and island nation B gets cheaper food which translates into more free time. The problem is, island nation B is giving all their wealth to island nation A in exchange for cheap disposable goods that doesn't add any wealth to their nation. This can lead to all sorts of issues, inflation, or island nation A deciding to purchase all the land and businesses from island nation B.

This is the intrinsic problem to free trade. You're giving a foreign entity wealth in exchange for worthless junk.",cws4m79,1446955516
cws2ay6,IAmWhiteBoy,"I don't need to make up for it. My family has lived in California for generations. If anything, the only people I owe reparations to would be the Chinese and Irish who were horribly abused during the gold rush era of California. Guess what? I'm Irish. Where's my money?",cws13yq,1446924915
cx0fj6u,bobfrompinecreek,"&gt;Many famous painters and musicians didn't make enough to live off their art.

If someone is famous for their art/music they are making a living off of it.

&gt; but why can't amateur or learning artists call themselves artists

Calling yourself an ""artist"" has become pretentious (""I'm an arteeest"" with a dumb beret and a smug face). In terms of a profession, the same way you shouldn't call yourself a house builder until you can build a sound home (being able to make money off your craft now comes with the territory. OMG CAPITALISM IT'S THE APOCOLYPSE!!!), you shouldn't call yourself an artist. ""Starving artist"" is the tongue-in-cheek, proper term.",cx0f00z,1447548124
cx2yp6v,Yggdras1l,"I work 80 hours a week (working on a PhD), have a 1 year old daughter, and still have time for the gym.  My Master's thesis was on a similar topic, analyzing quality of life and depression in nurses.  Those who chose a glass of wine, watching TV, or relaxing in a bath had significantly lower quality of life and significantly higher incidence of depression (p&lt;0.05 on both).  It is a choice not to exercise and it is a choice to make excuses.  It is also a choice to suck it up and meet the minimum physical activity guidelines of 30 minutes a day, 3 days a week of moderate to high intensity physical activity.

Those who do not exercise tend to have a more negative outlook, decreased QoL, increased depression, decreased self-confidence...all of this is avoidable! If a spouse refuses to exercise, they are selfishly hindering the relationship...there's no other way to say it.",cx2jt28,1447735297
cx3v9jj,Imakeatheistscry,"&gt;No difference whatsoever. As I said, what matters is the consequences of a phenomenon, not whether it has a scary visual and gets lots of media. From the perspective of the public good, a dead person is a dead person, no matter the cause.

Sure a dead person is a dead person no matter which way they died. I'm not arguing that. I am arguing on the punishment. You said that when 3,000 die via a terrorist it should be pursued as much as 3,000 that die from car crashes.

So assuming your entire family is murdered via a terrorist. You would be absolutely fine with him getting the same punishment as someone who accidentally killed an entire family in say, a car accident (small amount of prison or none at all).

&gt;ISIS is a pretty mild threat, probably as bad as the Medellin cartel or some other really big drug gang. But that's about it. Have an FBI office on them, sure, but no multi-trillion war. It's not bad enough to justify. Invest in poverty reduction instead.

Why invest in poverty reduction? As long as ISIS is around it isn't going to do shit. They already blow up schools as is. 

",cx3unii,1447801525
cx8ok7d,bokono,"Is depression ""curable""? What would you consider a"" cure"" for depression? SSRIs? There's plenty of contention as to their efficacy and they can have serious side effects such as the loss of sexual function and sensitivity. Would you consider the loss of your ability to perform or enjoy sex to be a serious quality of life issue? 

Also, where did you get that 90% figure from? 

You understand that depression isn't the only mental illness a person can suffer from right? There are a number of debilitating mental health conditions and disorders that can make life unbearable for those afflicted. ",cx88bxy,1448163530
cx96ef7,Celda,"It's not just fringe radicals that hold unpalatable views. It's feminists everywhere.

For instance, just last week, the University of York (England) planned to acknowledge International Men's Day. The statement about it highlighted issues like male-underachivement in university (which is true in all Western countries), male suicide and mental health (men are far more likely to commit suicide than women, etc.

You can read the original statement [here](https://www.reddit.com/r/unitedkingdom/comments/3t1l7p/university_of_york_cancels_international_mens_day/cx2ah47).

In response - a few hundred feminists at the university wrote a bigoted and self-serving letter to the university condemning International Men's Day, and saying that it was bad because it did not address women's issues (which was obviously the point).

Which you can [read here](http://www.nouse.co.uk/2015/11/16/open-letter-blasts-universitys-decision-to-mark-international-mens-day-read-it-here/).

Because of that, the university backtracked and cancelled it.

These are not just radicals - these are the people representative of feminism, far more than those who claim to be feminist but do nothing in the public sphere related to feminism.",,1448215784
cx9irae,Celda,"Why are you pasting one paragraph as though that proves anything?

If you wanted to accurately encapsulate the letter from one part, you should have used this:

&gt;The closing remark  gender equality is for everyone  echoes misogynistic rhetoric that mens issues have been drowned out by the focus on womens rights.

You're right - it seems pretty crazy to me. Feminists claiming that the statement ""gender equality is for everyone"" is misogynist rhetoric. 

And the position that men's issues have been drowned out by the focus on women's rights? Well, only a misogynist could think that - just look around you. It's not like we ever see that happening anywhere.

",cx9iazu,1448234799
cxaiybs,Dinaverg,"THe problem is that gang violence isn't directly counter to discussing gang violence, where as 'being drowned out' is directly counter to being heard complaining about being drowned out. Kinda like spending the majority of your time in a debate complaining you never get time to speak in  the debate. ",cx9vl85,1448310409
cxajgr6,Celda,"So if a feminist group was banned by the university without good reason, if they then claim that they are being silenced, then their claims are false. Since they are able to complain about being silenced, thus they weren't silenced.

Edit: Or, if anyone complained about the government silencing dissent or protests, then their complaints are invalid. Since we can hear the complaints about the government silencing dissent.

Your logic is ridiculous.",cxaiybs,1448311128
cxauglu,whosewoods,"&gt;To a certain extent, our actions are an extension of our personality and the views we hold, so if your gay friend says ""I don't like it when you say that"" and you continue to do so, it would indicate to me that you respect your gay friend (and possibly other gay people too) less than they deserve since I have no doubt you would cease saying ""nigger"" if a black friend told you they had a problem with it.
 
 To a certain extent, indeed. This is the crux of the /r/SRS vs Reddit at Large movement. To what extent do we owe other people the right to not be offended at the expense of our own expression. I might counter to a close friend offended by something I said that, ""I don't like it when you put your personal negative connotations associated with language on my expression."" Obviously there's some kind of line to be drawn. It's unreasonable for me to shout ""nigger"" in Times Square and be self-righteous about people being offended. But what if I say a white lady practicing yoga is culturally appropriating from Asian culture? Being that ""gay"" as an insult so ubiquitous among self-identified not-homophobes, I think it's unreasonable for someone to assume that calling something ""gay"" is necessarily bigoted. It may make you uncomfortable. It may imply bigotry, just as me saying ""bitch"" might imply misogyny. If I stub my toe and shout ""bitch"" it's probably not very indicative of anything. If I call a woman I'm on a date with a bitch for not giving me a blow job under the table, I might not be a feminist.  ",cxa7vin,1448327837
cxbjvr9,ElysiX,"&gt;we all know what morality is [...] You can figure out what I meant

Yes and i figure you mean you (or your peers) have supreme authority over morals and that there is one moral system that is the right one, being your one, and all others are wrong.",cxbjr7e,1448385108
cxcj87x,BenIncognito,"&gt; Therefore, whites are more likely to be the victims of other races and should be outraged that nobody recognizes their plight

This has nothing to do with the BlackLivesMatter movement, if white people ought to be outraged - then you need to be upset with white people, not movements dedicated to black people.

&gt;  black people should worry about the fact that they are killing eachother at a number near equal to that of whites when they make up less than 1/5th of the population.

Black people do worry about this, like...a lot. Every single time black people are upset over a police shooting this point is trotted out as though nobody gives a shit.

[Well](http://www.slate.com/articles/news_and_politics/politics/2014/12/black_community_is_concerned_with_black_on_black_crime_suggesting_otherwise.html) [they](http://mediamatters.org/research/2014/12/01/fox-news-pundit-cant-remember-any-of-these-time/201725) [do.](http://usatoday30.usatoday.com/news/opinion/forum/story/2012-06-12/jesse-jackson-gun-violence-marches/55527742/1)

So called ""black on black violence"" is a *huge* topic of discussion within black communities.

Now, on to your actual view - which none of the 135 words you've posted actually backs up. In what way is the BlackLivesMatter movement misguided? Do you even know what it is they're advocating for or what they want to address?

If black people commit more violence against black people, does that negate the violence committed against black people by the police? Are people only allowed to be outraged about one thing at a time?",,1448457562
cxcq4sj,Tappen_Zee,"""Are people only allowed to be outraged over only one thing?""

You just sealed OP's point, they aren't outraged by black on black crime. They aren't drawing any attention to it and that's the point, that's why it is misguided. Police shootings is a much smaller problem than black on black crime and there is absolutely no focus of any sort on it. If they really cared about the deaths of blacks, they would focus on the largest problem in addition to police shootings. But they don't, they never discuss it, and if people even bring it up an argument starts about it rather than admitting it is even an issue. 

Edit: people down voting me are only supporting and sharing the negative stereotypes of BLM. People don't care about social discourse anymore. They want to be heard and don't want to listen. ",cxcj87x,1448470146
cxcjfcu,brewski4broski,"I don't care if people are killed or not, black or white or asian. In general, what happens to other people is not something I concern myself with. I take the ""BlackLivesMatter"" tagline as people thinking that I *NEED* and *SHOULD* care about every single black person who is killed. 

Why can't I Just care about people in my life who are cared, instead of strangers?",,1448458083
cxcobjl,BenIncognito,"&gt; It's really not difficult to understand. I'm also sure most of the people saying ""educate yourself"" would agree that it doesn't take very long to look up. Maybe, just maybe when someone disagrees with you it isn't because they ""don't understand enough"". Maybe that's just what you run to when you can no longer defend your position.

If you spent that little bit of time to look it up, you would know perfectly well why there is backlash. It isn't a double standard, since AllLivesMatter and WhiteLivesMatter are nothing but excuses to dismiss black people and their strife.

&gt; Or maybe it's about bringing people of all races together and not obsessing over a skin color. You can still talk about black lives issues under an AllLivesMatter movement.

That's horseshit. Where was AllLivesMatter before black people decided they needed a movement to talk about the real danger they face from police?

&gt; Lol can you honestly not see how blacklivesmatter=progressive and whitelivesmatter=racist trash is so obviously a double standard? This isn't a zero-sum game, both are important and saying one doesn't take anything away from the other.

White lives already matter, a lot, to society. I've already explained to you where the double standard is - but you would rather pretend that all I said was ""educate yourself"" and ignore my position.",cxco7ew,1448467403
cxd0wlu,Meigou_pengyou,"While your arguments are valid and sound I have one question for you.

If all lives matter, why is it so hard for those supporters to say, blacklivesmatter?

So, I ask, do you think blacklives matter?

Saying black lives matter, doesnt mean, white lives, or asian lives DONT matter. Black lives are a subset of all lives! 

So can I see you write black lives matter?

If not then you can see why the alllivesmatter movement is more about overshadowing the blacklives matter movement. ",cxcqybo,1448486482
cxeaq6q,wedontluvthemhoes,"&gt;someone can dislike the label of feminism without being against women's rights

What is ""the label of feminism"" though? What does that even mean? Either you're against feminism itself, or you're not.

If you're against feminism that means you *stand against the struggle for gender equality*. It means you want men to remain in a position of privilege in society. 

Its like saying ""Im pro-racism but im not racist"".

&gt; People can dislike the actions done under the label of feminism, and thus be anti-feminism

You can dislike stereotypical tumblr feminists without being against feminism though, cant you? Since those people make up a small minority of all feminists it doesnt make sense to be anti-feminism.

It makes about as much sense as being anti-white people because of all the school shootings.",,1448589693
cxh80zh,klw,"You wish to remove privilege in order to legalize plural marriage? So, reduce rights? What a deal.",cxh7oga,1448836990
cxhd9y7,ILikeLeptons,i think you're presenting a false dichotomy. recognized polyamorous marriages does not imply revoking spousal incrimination in courts.,cxhbkln,1448845463
cxk452q,Nightstick11,"You have a Canadian guy looking at PRISON TIME for literally disagreeing with some feminists on twitter. 

You have students who get EXPELLED from college, professors and presidents who get FIRED, for saying something that hurt someone's feewings. An expelled student cannot go to another university. Professors cannot find jobs readily. PC types would literally sentence someone to a lifetime of economic hardship because they disagreed with you. 

Europeans go on trial and face fines or prison for saying things that someone disagrees with. 

How is the free world NOT being overrun by sensitive lunatics?

Other countries throw people in prison for literally saying things others do not. How many generations until Americans suffer the same draconian fates? You already have unhumanlike savages who think nothing of. Urning businesses owned by people they dosagree with or stalking people job to job in an attempt to get fired for simple disagreements. ",,1449036034
cxol4td,sumnihil,"As a bit of a qualifier, I do agree that corporal punishment *as it is commonly practiced* is inappropriate. However, disagree that it is *a priori* harmful, and will move forward with that proviso

&gt;It teaches kids that in order to get people to do what you want, you should inflict pain

Applied broadly, this idea would make any punishment inappropriate. 

* Time outs or grounding: in order to get people to do what you want, you should isolate them socially

* Taking away of privileges or games: in order to get people to do what you want, you should deprive them of things they enjoy.

* Forced public apologies and reparation: in order to get people to do what you want, you should publicly humiliate them.

The fundamental purpose of any punishment should be to condition a negative response to a certain stimulus, not merely to inflict your will upon another. The tricky part comes in dealing with which stimulus the child ends up associating with a punishment response. The research I have read (and please understand this is not extensive. I have only a BS in psychology, and avoided much developmental psych. I was focused more on the neurobiology of psychology than behavioral psych) is almost all based on survey data and is inherently biased. Those who most strongly remember being spanked were spanked inappropriately, and associated their punishment not with whatever caused the spanking, but with the emotional state of the parent who spanked them.

I do not know of any research that focuses on spanking as a passionless consequence of rule breaking.

&gt; I believe it also causes kids to fear their parents... it isn't fair to essentially attack kids because you are angry with them

Again, this is a problem with the application of corporal punishment, rather than its merit. If you are hitting your child because you are angry with them, or in order to show dominance, then these statements are certainly true, and you are likely being abusive. The same is also true if you yell at a child and send them to their room, or force them to sit in a corner and cry. It is the attitude of the punisher, not the punishment (within reason, certainly. Calmly punching your child is still clearly abusive) that can harm the child's psyche.

I am going to give some personal information now, and you may well ignore it as anecdotal (and will in fact cover two points you raised above regarding children being different and how I was spanked as a child), but I have found nothing that counters its merit.

I grew up with a sister and a step sister. I was imaginative and precocious. Time outs, grounding, and deprivation were nothing to me, as I lived mostly in my own head anyway. No punishment was sufficiently onerous to me to alter my behavior in any way. My sisters, however, could not stand these punishments, and feared them greatly. Finally, my stepfather and mother told me that, for certain offenses, I would be spanked. What qualified as a spanking offense was made clear to me, and a promise was made that I would never be spanked in anger. The same deal was made with my sisters because they wanted to be fair, but each was only ever spanked once, as it was clear to both of my parents that they suffered much too greatly in relation to the severity of the crimes they were punished for. 

I was spanked with fair (though decreasing) regularity as a child. And each time, I feared the spanking, though I suspect no more than my sisters feared time outs. I never feared my stepfather outside of the times I knew I was going to be spanked, and I always knew ahead of time because I knew the rules. He never hit me while angry, and he always made sure that I knew that I was being punished for what I did, not for what I was. I never felt shame or humiliation at being spanked, and was never told it was for my own good.

The long and the short of it is that I learned that my actions have consequences, and sometimes those consequences are unpleasant. I agree that most parents don't approach spanking this way, and the way that most parents do approach it is wrong. But if approached dispassionately, with clearly defined boundaries, it is one of the strongest ways to condition a child's behavior. ",,1449362089
cxrmq9w,geminia999,"&gt;  For example even though each politician as an individual might be a good person and willing to work for the common good, when they are inside a bipartisan elective system in which corruption is legal, their good intentions do not matter that much. You could replace all the individuals within the political system and it wouldn't really change the situation on the long term (same causes, same effects).

Would you say it's okay to say that an individual good person is considered at fault for being in such a system (especially if it was at a system where they had no choice to be considered a member of)?

It seems you are somewhat unfamiliar with the situation going on (or so I assume from how you write) so I can't necessarily give a good or unbiased summary, but I do personally see some stuff like that quite a bit in regards to social justice. That a white person is considered inherently racist for being into a system that is considered racist.

While I may agree a huge overhaul of a system may be required, there is quite a bit of blame and animosity put towards the people that form such a system and I don't see that as being much better.",cxrlsqi,1449591512
